Swedish Medical Center Foundation|910983214|Approved|747 Broadway|Seattle|WA|98122|Ms. Susan Hoffman|Finance Manager|(206) 386-2741|(206) 320-3160|www.swedish.org|Human Services|Care and treatment of patients, offering a full range of health care services.Swedish Medical Center Foundation: To improve the health and lives of community members by providing charitable support to Sacred Heart Medical Center.Swedish Medical Center Foundation: To improve the health and well-being of each person we serve.
American Heart Association Inc|135613797|Approved|710 Second Avenue|Seattle|WA|98104|Elly Henderson|Office Coordinator|(206) 632-6881|(206) 632-8478|www.heart.org|Human Services|To reduce disability and death from cardiovascular disease and stroke.American Stroke Association: To reduce disability and death from cardiovascular disease and stroke.
KCTS Television|911221895|Approved|401 Mercer Street|Seattle|WA|98109-4699|Mr. Brett Coffee|Manager Member Services|(206) 443-6784|(206) 443-6691|www.kcts9.org|Arts & Culture|KCTS Television: To serve the public television community through a dynamic network of organizations that provide program distribution, digital television, analog and cable channels, program production and distribution, community outreach, retail activities and more.KCTS Television: KCTS Television: To serve the public television community through a dynamic network of organizations that provide program distribution, digital television, analog and cable channels, program production and distribution, community outreach, retail activities and more.KCTS Television: To improve the quality of life in the communities we serve by providing meaningful programming on air, online and in the community that informs, involves and inspires.
KPLU|910565571|Approved|12182 Park Avenue South|Tacoma|WA|98447|Ms. Sarah McAtee|Data & Gift Processing|(253) 535-7702|(253) 535-8769|www.kplu.org/|Arts & Culture|A member station of National Public Radio, KPLU provides music and news seven days a week, 24 hours a day, with a professional staff augmented by qualified students.  PLU is the only independent university in the Northwest operating a full power NPR station.Pacific Lutheran University: Produces and presents a wide range of programming of the highest professionalism and quality.
KUOW|912079402|Approved|4518 University Way NE|Seattle|WA|98105|Ms. Elizabeth Hovance|Director, Research & Analysis|(206) 616-9013|(206) 543-2720|http://www.kuow.org/|Arts & Culture|To create and serve an informed public, one challenged and invigorated by an understanding and appreciation of events, ideas, and cultures.KUOW Puget Sound Public Radio: To create and serve an informed public, one challenged and invigorated by an understanding and appreciation of events, ideas and cultures.
Market Foundation|911197625|Approved|85 Pike Street, Room 500|Seattle|WA|98101|Ms. Rainelle Sizemore|Systems Coordinator|(206) 774-5243|(206) 682-7447|www.pikeplacemarketfoundation.org|Human Services|Provides a home to 500 residents, most of whom are low-income seniors, as well as a variety of services for the needy.
Lifelong|911215715|Approved|PO Box 80547|Seattle|WA|98108|Aya Mizoroki|Development Clerk|(206) 328-8979|(206) 325-2689|www.lifelongaidsalliance.org|Human Services|Committed to preventing the spread of HIV, and to providing practical support services and advocating for those whose lives are affected by HIV and AIDS.Lifelong AIDS Alliance: To ensure and maintain the highest quality of life for people living with HIV/AIDS, preventing the spread of HIV/AIDS, and advocating for all those whose lives have been affected by HIV/AIDS.Lifelong AIDS Alliance: To ensure and maintain the highest quality of life for people living with HIV/AIDS, preventing the spread of HIV/AIDS, and advocating for all those whose lives have been affected by HIV/AIDS.Lifelong AIDS Alliance: Committed to preventing the spread of HIV, and to providing practical support services and advocating for those whose lives are affected by HIV and AIDS.Lifelong AIDS Alliance: Improving the nutritional status of people living with HIV/AIDS and other life-challenging illnesses in Seattle/King County.
Southern Poverty Law Center Inc|630598743|Approved|400 Washington Avenue|Montgomery|AL|36104|Ms. Felecia Taylor|Special Gifts Coordinator|(334) 264-0286|(334) 264-6892|www.splcenter.org|Civic|To fight hate and bigotry, and to seeking justice for the most vulnerable members of society.
Princeton University|210634501|Approved|330 Alexander Street, Box 5357|Princeton|NJ|08543-5357|Ms. Helen Hardy|Gift Processing  Manager|(609) 258-8283|(609) 258-6773|www.princeton.edu|Education|To strive to be both one of the leading research universities and the most outstanding undergraduate college in the world.
Dartmouth College|20222111|Approved|6066 Development Office|Hanover|NH|03755-3555|Ms. Dorothea Kingsbury|Matching Gift Coordinator|(603) 646-0098|(603) 646-8654|http://www.dartmouth.edu|Education|The first graduate school of businessâ¬and is one of the top management schools in the world. Tuck offers only one degree programâ¬the full-time MBA.
University of Oregon Foundation|936015767|Approved|1720 E 13th Ave|Eugene|OR|97403-2253|Ms. Dianna DuClos|Gift Receipt Tech II|(541) 302-0290|(503) 344-8079|http://uofoundation.org|Education|To serve the university by assuming responsibility for development and financial support, by managing and administering Foundation assets, and by leading in advocacy of the university."
Virginia Polytechnic Institute|540721690|Approved|Alumni Hall, 201 Pack Building|Blacksburg|VA|24061-0336|Miss Erin Kinder|Matching Gift Coordinator|(540) 231-2889|(540) 231-8185|www.givingto.vt.edu|Education|The Foundation serves the university by generating significant funding from private sources and aggressively managing its assets to provide funding which supplement state appropriations.Hokie Spirit Memorial Fund: To remember and honor the victims of tragic events, the university has established the Hokie Spirit Memorial Fund to aid in the healing process and generate financial support.
AIDS ACTION Committee|222707246|Approved|75 Amory St|Boston|MA|02119|Ms. Matching Gifts|Development Officer|(617) 450-1215|(617) 437-6445|http://www.aac.org/|Human Services|To stop the epidemic by preventing new HIV infections and optimizing the health of those already infected.
Leukemia & Lymphoma Society Inc|135644916|Approved|Washington/Alaska Chapter|Seattle|WA|98107|Mrs. Anne Gillingham|Executive Director|(206) 628-0777|(206) 292-9791|www.lls.org/wa|Human Services|To cure leukemia, lymphoma, Hodgkin's disease and myeloma, and improve the quality of life of patients and their families.Leukemia & Lymphoma Society Inc: Cure leukemia, lymphoma, Hodgkin's disease and myeloma, and improve the quality of life of patients and their families.The Big Climb Seattle, Leukemia & Lymphoma Society: To cure leukemia, lymphoma, Hodgkin's disease, and myeloma and to improve the quality of life for patients and their families.
Oregon Shakespearean Festival Endowment Fund Inc|936041618|Approved|15 South Pioneer|Ashland|OR|97520|Ms. Carol Bue|Membership Supervisor|(503) 482-2111|(541) 482-6917|www.osfashland.org/|Arts & Culture|To productions of high quality of William Shakespeare's plays and other works of literary and theatrical value.Oregon Shakespeare Festival Association - Daedalus Project: Commits to the end of AIDs by an array of events
A Contemporary Theatre Inc|910787792|Approved|700 Union|Seattle|WA|98101|Mr. Kyle Thompson|Development Coordinator|(206) 285-3220|(206) 292-7670|http://www.acttheatre.org/|Arts & Culture|To produce a season of plays from April - November, including the holiday classic, A Christmas Carol in December, and a wide variety of smaller productions, readings and workshops throughout the year from its spectacular theatre facility in downtown Seattle.
Awana Clubs International|362428692|Approved|One East Bode Road|Streamwood|IL|60107-6658|Mrs. Melody Gateley|Corporate & Foundations Manager|(630) 213-2000|(630) 213-5986|www.awana.org|ReligiousParent|Christian youth ministry that partners with local churches to evangelize and train youth via Bible-based, Christ-centered, weekly club programs and leadership training.
People For Ethical Treatment Of Animals|521218336|Approved|501 Front Street|Norfolk|VA|23510|Jennifer McCloud|Income Coordinator|(757) 622-7382|(757) 628-0786|http://www.peta.org/|Civic|Dedicated to establishing and protecting the rights of all animals. PETA operates under the simple principle that animals are not ours to eat, wear, experiment on, or use for entertainment.
Planned Parenthood of the Great Northwest|910686012|Approved|2001 East Madison St.|Seattle|WA|98122-5397|Ken Barner|Mr.|(206) 328-7529|(206) 328-6810|www.ppgnw.org/|Human Services|To ensure that all people in our communities can make informed choices about reproductive and sexual health. Can provide advocate to preserve the fundamental right to reproductive self determination, offer high quality, cost effective clinical services, and provide educational services to foster understanding of human sexuality and promote responsible behavior.Planned Parenthood of Western Washington: Provides reproductive health care, Pap tests, STD treatment, contraceptives, surgical and medical abortions, emergency contraception, education and counseling in 17 clinics located in Western Washington.Planned Parenthood Of Idaho Inc: Planned Parenthood of Idaho is a non-profit family planning agency located in the Treasure Valley and Magic Valley. We provide quality health care services  and comprehensive sexuality education  to all people regardless of age, income, marital status, or sexual orientation. We are an advocate  for the freedom of individuals to choose how to live their lives. This freedom includes the right to decide freely and responsibly if, and when, to have a child. PPI helps ensure that children will be wanted and loved, that families will be strong and secure, and that choice rather than chance will guide the future of humanity.Planned Parenthood of the Great Northwest: Provides reproductive health care, Pap tests, STD treatment, contraceptives, surgical and medical abortions, emergency contraception, education and counseling in 17 clinics located in Western Washington.Planned Parenthood of the Great Northwest: To support the lifelong sexual health of women and men, and to foster a community where every child is a wanted child.
Gay Mens Health Crisis Inc|133130146|Approved|446 W 33rd Street|New York|NY|10001|Lindsay Hoffman|Director, Institutional Development|(212) 367-1450|(212) 367-1450|http://www.gmhc.org|Human Services|To provide compassionate care to New Yorkers with AIDS; educate to keep people healthy; advocate for fair and effective public policies.Aids Walk New York: To have the money raised in the Walk go directly to vital services to help people living with HIV or AIDS.Gay Mens Health Crisis Inc: To assist in funding research to cure the Aids epidemic.Gmhc Health Services, Inc.: To reduce the spread of HIV disease, help people with HIV maintain and improve their health and independence and keep the prevention, treatment and cure of HIV an urgent national and local priority.Aids Walk New York: To reduce the spread of HIV disease, help people with HIV maintain and improve their health and independence, and keep the prevention, treatment and cure of HIV an urgent national and local priority.Gay Mens Health Crisis Inc: Committed to national leadership in the fight against AIDS.  Our mission is to reduce the spread of HIV disease, help people with HIV maintain and improve their health and independence, and keep the prevention, treatment and cure of HIV, an urgent national and local priority.
Evergreen State College Foundation|910981488|Approved|2700 Evergreen Parkway NW|Olympia|WA|98505-0002|Mr. Michael Wood|Fiscal Specialist|(800) 781-7861|(360) 866-6977|www.evergreen.edu/user/homef.htm|Education|To assist, strengthen and further in every proper and useful way the purposes., work and services of the college, and to develop, enhance and utilize the ties of interest, concern and affections existing between the college and its alumni and friends throThe Evergreen State College Annual Fund: To support the college by developing strong community relations and securing financial support for the college.
Wilderness Society|530167933|Approved|1615 M. Street NW|Washington|DC|20036|Robin Taylor|Development Assistant|(202) 833-2300|(202) 429-3957|www.wilderness.org|Civic|Mission:  To secure the preservation of the American wilderness wherever found and for this purpose to make or to initiate or cause to be made scientific studies and investigations concerning wilderness areas, their  values and uses to the public and the best methods for their protection......
North Park University|361557840|Approved|3225 W. Foster Ave. Box 6|Chicago|IL|60625-4895|Megan Walker|Development Services Assistant|773-244-5755|773-244-4953|www.northpark.edu|Education|Established in 1891, the program includes Liberal Arts and General, Teacher Preparatory, and Professional.  THe highest degree offering is Doctorate.  1st quarter 1998.
University of Washington Foundation|943079432|Approved|Box 359504|Seattle|WA|98195-9505|Ms. Rachel Townsend|Matching Gift Coordinator|(206) 685-9416|(202) 685-2692|http://www.washington.edu/|Education|To support excellence in programs throughout the University of Washington.Univeristy of Washington Foundation: To spread equity and diversity by opening doors for girls and women through education and access to resources that will help them achieve personal, professional, and academic success.University of Washington Foundation Communications Discretionary Fund: Unrestricted support for the Department of Communication within the College of Arts and Sciences. Gifts to this fund are used at the discretion of the Chair and are directed where they are needed most.
University of Wisconsin Foundation|390743975|Approved|1848 University Avenue|Madison|WI|53726-4090|Ms. Sue Woods|Matching Gifts Coordinator|(608) 263-4545|(608) 263-0781|www.supportuw.org|Education|To understand the decisions of businesses and consumers as well as the implications and causes of contemporary economic issues by developing a systematic and thorough understanding of precisely how economic systems operate.
YWCA of Seattle- King - Snohomish County|910482890|Approved|1118 5th Ave|Seattle|WA|98101|Mrs. Norma Addis|Director of Donor and Information Services|(206) 490-4362|(206) 490-4385|http://www.ywcaworks.org|Human Services|Designed to help homeless families begin the process of rebuilding their lives.YWCA of Seattle: To advance the quality of life for women of all ages, races, and faiths, and their families.
Holy Ghost Preparatory School|231365959|Approved|2429 Bristol Pike|Bensalem|PA|19020|Mrs. Shannon Perkins|Annual Fund Manager|(215) 639-2102|(215) 639-4225|www.holyghostprep.org/index.php|Education Priv (K-12)|Dedicated to the quality education of college-bound young men.Holy Ghost Preparatory School: The school welcomes young men into a close and supportive circle of caring adults and fellow students and guides them as they grow morally, intellectually, and spiritually.
University of Notre Dame|350868188|Approved|1100 Grace Hall|Notre Dame|IN|46556|Ms. Patty Herrity|Matching Gifts Coordinator|(574) 631-8199|(219) 631-7428|www.nd.edu/|Education|A defining Catholicity that guides our search for truth and inspires students, faculty, and alumni to lead lives of faith, meaning, and service.University of Notre Dame: To create formative educational and service experiences in collaboration with diverse partners, calling us all to action for a more just and humane world.
Earthjustice|941730465|Approved|50 California Street|San Francisco|CA|94111|Ms. Allison Keller|Stewardship and Donor Relations Associate|(415) 217-2000|(415) 217-2040|www.earthjustice.org|Civic|Dedicated to protecting  the magnificent places, natural resources, and wildlife of this earth and to defending the right of all people to a healthy environment.Earth Justice Legal Defense Fund: To protect people and natural resources by enforcing and strengthening environment laws, to educate and involve the public in sustaining citizen enforced law.
World Wildlife Fund Inc|521693387|Approved|1250 24th Street Northwest|Washington|DC|20037|Ms. Carolina Ayala|Matching Gifts Coordinators|(202) 495-4333|(202) 331-8833|www.worldwildlife.org|Environment|To conserve nature.World Wildlife Fund Inc: To protect endangered species and their habitats. Now in its fifth decade, WWF works in more than 100 countries around the globe to conserve the diversity of life on earth. With nearly 1.2 million members in the U.S. and another 4 million worldwide, WWF is the world's largest privately financed conservation organization.World Wildlife Fund: To preserve the diversity and abundance of life on Earth and the health of ecological systems
Humane Society of the United States|530225390|Approved|2100 L Street N.W.|Washington|DC|20037|Mr. Jared Gonzales|Matching Gifts Coordinator|(202) 452-1100|301-721-6462|humanesociety.org|Civic|Dedicated to creating a world where our relationship with animals is guided by compassion. We seek a truly humane society in which animals are respected for their intrinsic value, and where the human-animal bond is strong.Humane Society Of The United States: To create a humane and sustainable world for all animals, including people, through education, advocacy, and the promotion of respect and compassion.Humane Society Of The United States: To create a humane and sustainable world for all animals, including people, through education, advocacy, and the promotion of respect and compassion.Humane Society Of The United States: Dedicated to creating a world where our relationship with animals is guided by compassion. We seek a truly humane society in which animals are respected for their intrinsic value, and where the human-animal bond is strong.The Hsus: Animal Protection and Welfare
United Way of King County|910565555|Approved|720 2nd Ave|Seattle|WA|98104-1702|Mr. Jon Fine|President And Ceo|(206) 461-3700|(206) 461-8435|www.uwkc.org|Human Services|To strengthen our communities by enhancing the ability of people to care for one another.United Way of King County: To strengthen our communities by enhancing the ability of people to care for one another.United Way of King County: To strengthen our communities by enhancing the ability of people to care for one another.United Way of King County: To strengthen our communities by enhancing the ability of people to care for one another.United Way of King County - Focus On Children: To strengthen our communities by enhancing the ability of people to care for one another.United Way of King County - Reducing Homelessness: To strengthen our communities by enhancing the ability of people to care for one another.United Way of King County-Youth Connection: To strengthen our communities by enhancing the ability of people to care for one another.
Phi Beta Kappa|530226282|Approved|1606 New Hampshire Avenue NW|Washington|DC|20009|Laura Hartnett|Coordinator of Administration|(202) 265-3808|(202) 986-1601|www.pbk.org|Education|The Nation's Oldest and Most Widely Known Academic Honor Society
Washington State University Foundation|911075542|Approved|P.O. Box 641927|Pullman|WA|99164-1927|Ms. Katherine Burnham|Matching Gifts Coordinator|(509) 335-1686|(509) 335-5903|http://www.wsufoundation.wsu.edu|Education|To enhance the intellectual,creative and practical abilities of individuals.Washington State University Foundation: The Mission of the Washington State University Foundation isto promote, accept, and maximize private support for programs, initiatives, and properties of Washington State University and its regional campuses.Washington State University Athletic Foundation: To provide a meaningful experience, through educational and capital support, for all of Washington State University's student-athletes in competition, the classroom, and the community; to identify, recruit, cultivate, and steward alumni and friends so that the foundation of support for the Athletic Department continues to expand.Washington State University Cougar Athletic Fund: To conduct transformational research  and provides world-class education  to more than 26,000 undergraduate, graduate, and professional students.WSU-Mount Vernon REU: The Mt. Vernon Research Extension Unit is part of Washingon State Univ.
Names Project Foundation|943055367|Approved|204 14th Street NW|Atlanta|GA|30318|Mr. Jim Marks|Chief Financial Officer|(404) 688-5500|(404) 688-5552|www.aidsquilt.org|Human Services|To use the Aids Memorial Quilt to help bring an end to the AIDS epidemic.  To provide a means for remembrance and healing; to illustrate the enormity of the AIDS epidemic.  To increase public awareness of AIDS.  To assist with HIV prevention education.Names Project - Dallas Chapter: Provide a creative means for remembrance and healing. Illustrate the enormity of the AIDS epidemic. Increase public awareness of AIDS. Assist HIV prevention education. Raise funds for community based AIDS service organizations.
Sudden Infant Death Syndrome Alliance Inc|521591162|Approved|2105 Laurel Bush Road|Bel Air|MD|21015|Ms. Gina Dyson|Chief Financial Officer|(800) 221-7437|(410) 653-8709|http://www.sidsalliance.org/index/default.asp|Human Services|To promote infant health and survival during the prenatal period through two years of age through advocacy, education and research.
Planned Parenthood Federation of America|131644147|Approved|434 W. 33rd Street|New York|NY|10001|Ms. Marybell Ortiz|Contributions Processor|(212) 261-4796|(212) 247-6416|www.plannedparenthood.org|Human Services|Provides urgently-needed family planning and education services to theworld's poorest families-training, supplies and technical assistance for locally-managed international programs.Planned Parenthood Foundation: To provide comprehensive reproductive and complementary health care services in settings which preserve and protect the essential privacy and rights each individual.Planned Parenthood Federation of America Inc: To provide comprehensive reproductive and complementary health care services in settings which preserve and protect the essential privacy and rights of each individual.Planned Parenthood Federation of America, Inc.: To promote the fundamental right of each individual, throughout the world, to manage his or her fertility, regardless of the individual's income, marital status, race, ethnicity, sexual orientation, age, national origin, or residence.
Childreach|135661832|Approved|155 Plan Way|Warwick|RI|02886|Ms. Shirley King|Donor Finance Manager|(800) 556-7918|401-738-5608|www.planusa.org|Human Services|To help needy children and their families in developing countries by providing community-based programs.
Reed Institute|930386908|Approved|3203 SE Woodstock Blvd|Portland|OR|97202-8199|Ms. Sheri R. Sedgwick|Gift Accounting Manager|(503) 777-7583|(503) 777-7798|www.reed.edu|Education|To provide a balanced, comprehensive education in liberal arts and sciences, fulfilling the highest standards of intellectual excellence.Reed Institute: To provide a balanced, comprehensive education in liberal arts and sciences, fulfilling the highest standards of intellectual excellence.
New Beginnings|911005916|Approved|P. O. Box 75125|Seattle|WA|98175-0125|Ms. Brittny Nielsen|Development Associate|(206) 926-3034|(206) 706-0291|newbegin.org|Human Services|Provide shelter, advocacy and support for battered women and their children Change attitudes and social institutions which foster and perpetuate violence
Pilchuck Glass School|910963132|Approved|240 2nd Ave S #100|Seattle|WA|98104|Angie Battalio-Bunker|Development Coordinator|(206) 621-8422|(206) 621-0713|www.pilchuck.com/|Arts & Culture|A comprehensive educational center for artists working in glass, and an international model for visual arts education.
YMCA Of Greater Seattle|910482710|Approved|909 Fourth Avenue|Seattle|WA|98104|Ms. Sok In|Financial Development|(206) 344-3190|(206) 382-7283|www.seattleymca.org|Human Services|Building a community where all people, especially the young are encouraged to develop their fullest potential in spirit, mind, and bodyHighline YMCA: To put Christian principles into practice through programs that build healthy spirit, mind and body for all.The Young Mens Christian Association of Greater Seattle: To put Christian principles into practice through programs that build healthy spirit, mind and body for all.YMCA - Eastside District/The Young Mens Christian Association of Greater Seattle: To build a community where all people, especially the young, are encouraged to develop their fullest potential in spirit, mind and body.YMCA - Highline: To put Christian principles into practice through programs that build healthy spirit, mind and body for all.
Seattle Opera|910760426|Approved|1020 John Street|Seattle|WA|98109|Mr. Michael Moore|Financial Services Coordinator|(206) 676-5578|(206) 389-7651|www.seattleopera.org|Arts & Culture|Strives to produce musically extraordinary, theatrically compelling operas, employing uniformly high-quality casts, dramatically aware conductors, and innovative yet textually concerned directors and designers.
