Dharma Drum Mountain Buddhist Association - Disaster Relief|113206048|Approved|90-56 Corona Avenue|Elmhurst|NY|11373-4047|Reverend Guo Sheng Shi|Controller|(718) 592-6593|(718) 592-0717|www.chan1.org|Civic|Committed to serving humanity by working to relieve human suffering â¬?physical, emotional and spiritual.
Childrens Hope International Foundation|431932814|Approved|11780 Borman Drive|St Louis|MO|63146|Mr. Cory Barron|Development Aid Director|(314) 890-0086|(314) 427-4288|www.childrenshope.net|Human Services|To give assistance in adoption to its members.Children's Hope International of Issaquah: Committed to walk out our faith through our mission of homes, health and hope to children in need, especially those who are without one or both parents.
Rodman Ride for Kids Inc|43329283|Approved|101 Washington St.|Foxboro|MA|02035-0000|Ms. Tracey Goulet|Executive Director|(508) 543-7892|(508) 543-8933|www.rodmanrideforkids.org|Human Services|To find the cause and cure of childhood brain tumors through support of medical research. To aid in early detection and treatment of childhood brain tumors.
Muscular Dystrophy Association|131665552|Approved|530 Maryville Centre Dr.,  Suite 410|Saint Louis|MO|63141|Mrs. Debbie Sewester|Administrative Assistant|(314) 962-0023|(314) 962-0553|http://www.mdausa.org|Human Services|To conquering neuromuscular diseases that affect more than a million Americans.Muscular Dystrophy Association: To combat neuromuscular diseases through programs of worldwide research, comprehensive medical and community services, and far-reaching professional and public health education.
Mi CASA for Children and Elderly|383651338|Approved|15600 San Pedro Ave, Ste 401|San Antonio|TX|78232|Mr. Rick Jones|Executive Director|(210) 545-4083|(210) 545-4087|www.micasafoundation.org|Human Services|To house, educate, and care for needy children and elderly in Mexico.
Crooked Trails|731669742|Approved|2115 E. Mercer Street|Seattle|WA|98112|Mrs. Tammy Leland|International Program Director|(206) 383-9828|(206) 320-0505|www.crookedtrails.com|Civic|To help people broaden their understanding of the planet and its diverse cultures through education, community development and responsible travel.Crooked Trails: A community-based travel organization helping people broaden their understanding of the planet and its diverse cultures through education, community development and responsible travel.
Americas Foundation for Chess|912051499|Approved|11120 NE 33rd Place, Suite 105|Bellevue|WA|98004|Karen Klages|Program Manager|425-629-4000|425-671-5009|http://www.af4c.org|Arts & Culture|America's Foundation for Chess has created a professionally designed, standards-based curriculum titled First Move &lt;http://af4c.org/club/page_navig.asp?NS=FMPI&gt;?? utilizing the game of chess as a learning tool for 2nd and 3rd grade students. Students are having fun learning, while the requirements set forth by the No Child Left Behind Act, and state standards are being met.
Maine Special Olympics|10355822|Approved|125 John Roberts Rd. Suite 5|South Portland|ME|04106|Linda Fredericks|Dir Admin Serv|(207) 879-0489|(207) 879-0672|www.somaine.org|Arts & Culture|To provide year-round sports training and athletic competition in a variety of Olympic-type sports for children and adults with mental retardation, giving them continuing opportunities to develop physical fitness, demonstrate courage, experience joy and participate in the sharing of gifts, skills and friendship with their families, other Special Olympics athletes, and the community.
Amyotrophic Lateral Sclerosis Association|133271855|Approved|Northern New England Chapter|Concord|NH|03301-5004|Ms. Sandra Silva|Office Manager|(603) 226-8855|(603) 226-8890|alsanne.org|Human Services|To fight to treat and cure ALS through global research and nationwide advocacy while also empowering people with Lou Gehrigâ¬"s Disease and their families to live fuller lives by providing them with compassionate care and support.
World Hope International Inc|351985485|Approved|1330 Braddock Place|Alexandria|VA|22314-1169|Harriet Johnson|Database Administrator|(703) 923-9414|(703) 923-9418|www.worldhope.org/|Civic|Mission StatementWorld Hope International is a faith based relief and development organization alleviating suffering and injustice through education, enterprise and community health.To the hungry, we offer life. To the forgotten, we give opportunity.To the outcast, we foster dignity.To the desperate, we bring hope.
Indigenous Language Institute|850405613|Approved|1501 Cerrillos Road, U-Building|Santa Fe|NM|87505|Miss Laura Benavidez|Executive Assistant|(505) 820-0311|(505) 820-0316|www.ilinative.org|Civic|The Indigenous Language Institute (ILI) recognizes the imminent loss of indigenous peoples' languages and acknowledges the individuality of indigenous communities. ILI facilitates innovative, successful community-based initiatives for language revitalization through collaboration with other appropriate groups and organizations, and promotes public awareness of this crisis.Indigenous Language Institute: The Indigenous Language Institute (ILI) recognizes the imminent loss of indigenous peoples' languages and acknowledges the individuality of indigenous communities. ILI facilitates innovative, successful community-based initiatives for language revitalization through collaboration with other appropriate groups and organizations, and promotes public awareness of this crisis.Indigenous Language Institute: The Indigenous Language Institute (ILI) recognizes the imminent loss of indigenous peoples' languages and acknowledges the individuality of indigenous communities. ILI facilitates innovative, successful community-based initiatives for language revitalization through collaboration with other appropriate groups and organizations, and promotes public awareness of this crisis.
Jewish National Fund|131659627|Approved|78 Randall Ave|Rockville Centre|NY|11570|Miss Dorothy Murphy|Donor Relations Representative|(516) 678-6805|(516) 763-6033|www.jnf.org|Civic|To be the caretaker of the land of Israel, on behalf of its owners - Jewish People everywhere.Jewish National Fund: Our work includes:  developing land, planting trees, building infrastructure for housing, parks and recreation areas, and helping to settle immigrants from across the globe.
Hallwalls Contemporary Arts Center|161104232|Approved|341 Delaware Ave|Buffalo|NY|14202-1803|Ms. Polly Little|Development Director|(716) 835-7362|(716) 835-7364|www.hallwalls.org/about.html|Arts & Culture|A. To provide a center for contemporary art.B. To recognize and serve a vital community artistic presence which is global in its outlook, challenging in its ideas, pluralistic in its concerns, and diverse in its expression. Hallwalls' twofold mission is to serve artists by supporting the creation and presentation of new work in the visual, media, performing, and literary arts, and to serve the public by making these works available to audiences. We are dedicated in particular to work by artists which challenges and extends the traditional boundaries of the various art forms, and which is critically engaged with current issues in the arts and--through the arts--in society. Finally, we believe that the right of freedom of expression for artists, and for free access to their works by interested individuals, must be protected as a fundamental and necessary condition of our mission
Compassion and Choices|841328829|Approved|PO Box 101810|Denver|CO|80250-1810|Susan Cooper|Donor Services|(303) 639-1202|(303) 639-1224|www.hemlock.org|Human Services|To see that every hopelessly ill, mentally competent American should have access to the full range of end-of-life choices, including the option of hastening one's death to end unbearable suffering.
Denver Art Museum Inc|846038240|Approved|100 West 14th Ave Parkway|Denver|CO|80204|Matthew Moore|Mr.|(720) 865-5000|(720) 913-0003|www.denverartmuseum.org/|Arts & Culture|Committed to making the museum an imaginative and playful family destination for children ages six to twelve and their adult companions.
Alzheimers Disease And Related Disorders Association|751984152|Approved|2630 West Freeway, Suite 100|Fort Worth|TX|76102|Mrs. Judy Rogers|Database Manager|(817) 336-4949|(817) 336-4966|www.alz/northcentraltexas.org|Human Services|Dedicated to advancing Alzheimer's research and helping those affected by the disease.
Alliance Francaise De Denver|846042159|Approved|571 Galapago St|Denver|CO|80204-5032|Mrs. Emily Kyle|Marketing and Development Manager|(303) 831-0304|(303) 573-0378|http://www.afdenver.org/|Arts & Culture|To encourage the study of the French language and culture and to foster the friendship between Francophones and people of all racial, national and ethnic origins.
Leukemia & Lymphoma Society Inc|135644916|Approved|3230 Commerce Place Suite B|West Palm Beach|FL|33407|Mrs. Tammy Breaux|Bookkeeper|(561) 775-9954|(561) 775-0930|www.leukemia-lymphoma.org|Human Services|Dedicated to funding blood cancer research, education and patient services to cure leukemia, lymphoma, Hodgkin's disease and myeloma, and to improve the quality of life of patients and their families.
Leukemia & Lymphoma Society Inc|135644916|Approved|2700 Westown Pkwy., Suite 260|West Des Moines|IA|50266|Mrs. Holly Stevens|Bookkeeper|(515) 270-6169|(515) 270-5392|www.leukemia.org|Human Services|To cure Leukemia, Lymphoma, Hodgkin's Disease and Myeloma, and to improve the quality of life of patients and their families.
Ywam Mission Builders|911734261|Approved|PO Box 406|Lakeside|MT|59922|Mr. John Briggs|CEO|(406) 844-2683|(406) 844-2680|www.missionbuilders.net|Civic|To provide strategic planning, resource, and facility development and support services to mission facilities in the United States and worldwide.
Chinatown International District Business Imp Area A Nonprofit Corp|911661557|Approved|507 S. King St|Seattle|WA|98104|Maribeth Ellis|Executive Director|(206) 624-8929|(206) 467-6376|http://www.internationaldistrict.org/|Civic|To promote economic vitality of the district, encourage responsible business development and support continuous improvement of the quality of life in the district for its business owners, residents, and visitors.
Assemblies of God World Missions - Community Outreach Programs|440577787|Approved|1445 N. Boonville Avenue|Springfield|MO|65802-1894|Ms. Patty Dense|Administrative Coordinator|(417) 862-2781|(417) 862-3439|http://worldmissions.ag.org/index.cfm|Human Services|Eligible Designations: HealthCare Ministries;
Northwest Arkansas Children Shelter|581984893|Approved|14100 Vaughn Road|Bentonville|AR|72712|Ms. Frankie Rankin|Development Director|(479) 795-2417|(479) 795-4195|http://www.nwacs.com/|Human Services|To provide a safe and nurturing atmosphere of hope for children in crisis and to sponsor programs that encourage individual growth and development.
South Dakota Special Olympics, Inc.|460359776|Approved|800 E I 90 Lane|Sioux Falls|SD|57104|Twila Hansen|Office Manager|(605) 331-4117|(605) 331-4328|www.sosd.org|Civic|To provide year-round sports training and athletic competition in a variety of Olympic-type sports for children (8 years and older) and adults with intellectual disabilities, giving them continuing opportunities to develop physical fitness, demonstrate courage, experience joy and participate in a sharing of gifts, skills and friendship with their families, other Special Olympics athletes and the community.
Victory Junction Gang Camp|562215292|Approved|4500 Adams Way|Randleman|NC|27317|Ms. Nona Pryor|Donor Database Manager|336 495 2038|336 498 9090|http://www.victoryjunction.org/|Civic|To enrich the lives of children with chronic or life-threatening illnesses by creating camping experiences that are memorable, exciting, fun, empowering, physically safe, and medically sound.Victory Circle Gang Inc: To enrich the lives of children with chronic or life-threatening illnesses by creating camping experiences that are memorable, exciting, fun, empowering, physically safe, and medically sound.
Alzheimer's Disease Research|237337229|Approved|22512 Gateway Center Dr.|Clarksburg|MD|20871-1950|Mr. Brian Klinzing|Senior Director, Strategic Relationships|(800) 437-2423|(301) 258-9454|www.brightfocus.org|Human Services|Dedicated to funding research on Alzheimer's disease, glaucoma, macular degeneration, heart disease, and stroke; educating the public about these diseases; and providing emergency financial assistance to Alzheimer's disease patients and their caregivers.
Shriners Hospital-Chicago|362193608|Approved|2211 N. Oak Park Ave.|Chicago|IL|60707|Ms. Denise Brennan|Donation Coordinator|(773) 622-5400|(773) 385-5453|http://www.shrinershq.org|Human Services|To improve the lives of children by providing pediatric specialty care, innovative research and outstanding teaching programs.
KLRU|757126012|Approved|P.O. Box 7158|Austin|TX|78713|Jacob Williamson|Database Manager|(512) 475-9123|(512) 471-0927|http://www.klru.org|Arts & Culture|To bring our community ideas and information to enhance education, culture and citizenship in the new information age. To provide excellent programming that educates and entertains, informs and inspires, and which is free and accessible to everyone.
Ronald McDonald House Of Long Island Inc|112764747|Approved|267 07 76th Ave|New Hyde Park|NY|11040|Mr. Matthew Campo|Executive Director|(718) 343-5683|(718) 343-5798|www.rmhlongisland.org|Human Services|A home away from home, providing comfort and shelter to families experiencing the pain of having a very sick child in an area hospital.  Families live with us, prepare their meals, and are able to come and go as necessary.
American Cancer Society Inc|131788491|Approved|8300 Health Park|Raleigh|NC|27615|Ms. Nikki Stephens|Administrative Assistant|(919) 334-5222|(919) 841-1422|www.cancer.org|Human Services|Dedicated to eliminating cancer as a major health problem by preventing cancer, saving lives, and diminishing suffering from cancer, through research, education, advocacy, and service.
The Arab American Institute Foundation|521959306|Approved|1600 K Street, NW|Washington|DC|20006|Ms. Jane Kaddouri|Director of Operations|(202) 429-9210|(202) 429-9214|http://www.aaiusa.org/|Civic|To support public information and education programs on the role of the Arab American community in American society.
American Council of the Blind|580914436|Approved|2200 Wilson Boulevard|Arlington|VA|22201|Nancy Marks-Becker|Accounting Clerk|(202) 467-5081|(202) 467-5085|http://www.acb.org|Human Services|To improve the well being of all blind and visually impaired people by:  serving as a representative national organization of blind people; elevating the social, economic and cultural levels of blind people; improving educational and rehabilitation facilities and opportunities; cooperating with the public and private institutions and organizations concerned with services for people who are blind;  working with aging networks and other organizations to promote programs and services inasmuch as visual impairment is often age related;  encouraging and assisting all blind persons to develop their abilities to the fullest extent possible;  and promoting greater understanding of blindness and the capabilities of blind people.
Red River Zoological Society|363938878|Approved|4255 23rd Ave S|Fargo|ND|58104|Ms. Lisa Tate|Director|(701) 277-9240|(701) 277-9238|www.redriverzoo.org|Arts & Culture|To foster awareness and appreciation of wildlife.  To advance public education on the need for wildlife conservation and preservation.  To exchange information and services with individuals and organizations interested in wildlife topics and issues.
Make-A-Wish Foundation of Tampa|592719588|Approved|324 N. Dale Mabry Hwy|Tampa|FL|33606|Mrs. Jennifer Cowley|Administrative Assistant|(813) 288-2600|(813) 288-2605|http://www.wish.org/suncoast/|Human Services|To fulfill the unique wishes of children with life threatening illnesses and to provide support to their families.
Reasons To Believe|330168048|Approved|818 S. Oak Park Road|Covina|CA|91724|Monica Jones|Ministry Advancement Assistant|(626) 335-1480|(626) 963-6504|www.reasons.org|Civic|To show that science and faith are, and always will be, allies, not enemies. Our mission is to bring that life-changing truth to as many people as possible, both believers and unbelievers.
For the Least of These|911076499|Approved|31605 Lake Sawyer Road Southeast|Black Diamond|WA|98010|||(360) 886-1643|(360) 886-8239|http://www.lscc.org/|Civic|To help orphans, vulnerable children and hurting families in need of life's basics; food, water, shelter and education.
Front Steps Inc|742824054|Approved|P.O. Box 684519|Austin|TX|78768-4519|Ms. Kay Klotz|Development Director|(512) 305-4100|(512) 482-0071|http://www.caha-austin.org/|Civic|To help transform a growing homeless population into persons who have the opportunity to live in safe, decent and affordable housing.
Kennedy Krieger Research Institute Inc|521524967|Approved|707 N. Broadway|Baltimore|MD|21205|Miss Rachel Bradley|Online Giving and Development Technology Manager|(443) 923-7304|(443) 923-7320|http://www.kennedykrieger.org/|Human Services|Dedicated to helping children and adolescents with disorders of the brain achieve their potential and participate as full  as possible in family, school, and community life
Noble and Greenough School|42104784|Approved|10 Campus Drive|Dedham|MA|02026|Ms. Kathleen Johnson|Office Manager|(781) 326-3700|(617) 329-8118|http://www.nobles.edu/|Education Priv (K-12)|To stimulate both significant intellectual growth and a strong sense of self-esteem in each student.
National Multiple Sclerosis Society|741266225|Approved|9830 Colonnade Blvd|San Antonio|TX|78230|Ms. Reginald Thompson|Accounts Receivable Coordinator|(210) 694-3200|(210) 496-5414|http://www.nationalmssociety.org/chapters/txh|Human Services|The Society helps people affected by MS by funding cutting-edge research, driving change through advocacy, facilitating professional education, and providing programs and services that help people with MS and their families move their lives forward.
The Leadership Institute|510235174|Approved|1101 North Highland Street|Arlington|VA|22201|Mr. David Hempel|Controller|(800) 827-5323|(703) 247-2019|www.leadershipInstitute.org|Civic|To produce a new generation of public policy leadership, unwavering in its commitment to free enterprise, limited government and traditional values and equipped with the practical skills to implement sound philosophy.
Unitarian Universalist Service Committee|521273585|Approved|689 Massachusetts Avenue|Cambridge|MA|02139|||(617) 868-6600|(617) 868-7102|http://www.uusc.org/|Civic|Unitarian Universalist principles that affirm the worth, dignity and human rights of every person, and the interdependence of all life, the Unitarian Universalist Service Committee is a voluntary, nonsectarian organization working to advance justice throughout the world.
Momentum for Mental Heath|941496052|Approved|438 North White Road|San Jose|CA|95127|Ms. Alithia Mendaros|Development Assistant|(408) 254-6828|(408) 259-2273|www.momentumformentalhealth.org|Human Services|Delivers a broad array of effective services that make mental health possible, promote dignity and respect for people with mental illnesses, and contribute to a healthier community.
International Dark-Sky Association|742493011|Approved|3223 N. First Avenue|Tucson|AZ|85719|Ms. Susan Ciarniello|Membership Director|(520) 293-3198|(520) 293-3192|http://www.darksky.org/|Environment|To preserve and protect the nighttime environment and our heritage of dark skies through environmentally responsible outdoor lighting.
Hillel the Foundation for Jewish Campus Life - Campus Superstar|256065236|Approved|4607 Forbes Ave|Pittsburgh|PA|15213|Julia Katz|Director of Development|(412) 621-8875|(412) 621-8861|www.hilleljuc.org|Civic|Campus SuperStar: This program is a American Idol-like solo singing competition featuring Pittsburgh area college students where are accompanied by a full band, with all of the glitz that one would expect from a concert, Broadway show or American Idol.
Hawaiian Humane Society|990073490|Approved|2700 Waialae Avenue|Honolulu|HI|96826|Allie Kelley|Development Coordinator|(808) 946-2187|808-955-6034|http://www.hawaiianhumane.org/|Civic|To prevent cruelty to animals, promote the humane treatment of animals and perpetuate the bond between humans and animals.
CASA for Children of DC|30472883|Approved|515 M Street, SE|Washington|DC|20003|Mr. Keenen Stevenson|Mentoring & Administrative Assistant|(202) 887-0007|(202) 887-0010|http://www.casadc.org/|Civic|To recruit, train and direct community volunteers appointed by a judge as Court Appointed Special Advocates (CASA) to speak up for abused and neglected children in the court system; provide information and recommendations to the judge in the best interest
