Arthritis Foundation Inc|943454386|Approved|4550 Post Oak Place|Houston|TX|77098|Ms. Tami Navarro|Event Coordinator/Office Manager|(713) 942-9063|(713) 942-9037|http://www.arthritis.org|Human Services|To find the cure for and prevention of arthritis, and provide services to improve the quality of life for people with arthritis.
Chihuahua Rescue And Transport|651018866|Approved|PO Box 2844|Durham|NC|27715|Ms. Carla Johnson|Treasurer|336-813-0800|919-684-0932|chihuahua-rescue.org|Human Services|To assist in finding homes for pets whose owners can no longer care for them. To rescue, foster and provide necessary veterinary care for homeless, abandoned, neglected, abused or unwanted Chihuahuas.
Parents for Public Schools Inc|943339278|Approved|3543 18th St.|San Francisco|CA|94110|||(415) 642-6260|(415) 468-7277|www.ppssf.org|Education|We are a network of parents working together to build and ensure quality public education for all children in San Francisco.
California Trout|237097680|Approved|360 Pine Street|San Francisco|CA|94104|Mr. Tony Van Houten|Membership Manager|(415) 392-8887|(415) 392-8895|http://www.caltrout.org/|Environment|To protect, preserve, and restore wild trout, native steelhead, and their waters, and to provide high quality angling adventures for the public to enjoy.
Capital Public Radio Inc|680223271|Approved|7055 Folsom Boulevard|Sacramento|CA|95826|Ms. Jennifer Halm|Director of Member Communications|(916) 480-5900|(916) 487-3348|www.csus.edu/npr|Arts & Culture|To be a trusted source of information, music and entertainment for curious and thoughtful people, strengthening the civic and cultural life of the communities we serve.
National Fallen Firefighters Foundation|521832634|Approved|PO Drawer 498|Emmitsburg|MD|21727|Ms. Crystal Mort|Data Communication Assistant|(301) 447-1365|(301) 447-1645|www.firehero.org|Human Services|To provide immediate and long term support for the families and coworkers of the fire-rescue personnel killed and missing.
Wilson Elementary PTO Parent Teacher Organization|752444151|Approved|200 S. Coppell Road|Coppell|TX|75019|Ms. Rachelle Blankenship|Vice President, PTO|(972) 462-8000|(972) 304-0074|www.wilsonpto.com/|Education|To promote the welfare of the children in home, school, and community. To develop between educators and parents united efforts that will secure for all the highest advantages in physical, mental, and social education. To bring a closer relationship between parents and teachers in the education of children.
St. Anthony Parish - Securing Our Future|20591038|Approved|314 S 4th St|Renton|WA|98057|Ms. Donna Schlager|Administrator|(425) 255-3132|(425) 271-4729|www.st-anthony.cc|Human Services|To provide funding exclusively to 63 programs and agencies that deliver, among other things, human services support to the poor and most vulnerable people in western Washington.Saint Anthony School-St Anthonys Parish: We are people of God called to be a Visible and Active Sign of the Life and Love Christ offers all Creation.Securing Our Future - to eliminate our current debt from the construction of the gymnasium, parking lot, and unification of the St. Anthony Campus (School)
Pulmonary Hypertension Association Inc|650880021|Approved|801 Roeder Road|Silver Spring|MD|20910|Ms. Maggie Bahrmasel|Development Associate|(301) 565-3004|(301) 565-3994|www.phassociation.org|Human Services|To find ways to prevent and cure pulmonary hypertension, and to provide hope for the pulmonary hypertension community through support, education, advocacy and awareness.
Christ United Methodist Church - Community Outreach Programs|311813333|Approved|3101 Coit Road|Plano|TX|75075|Ms. Brenda Dunai|Director of Finance|(972) 596-4303|(972) 596-4376|cumc.com|Civic|Eligible Designations: Community Programs; Nothing But Nets; Project Hope, Disaster Response Team; Bolivia Mission, House on the Corner; Bear with Me; School Supplies; Shoe Ministry; Honduras Mission
Providence St. Peter Foundation|911097056|Approved|413 Lilly Road NE|Olympia|WA|98506|Ms. Nancy Riordan|Executive Director|(360) 493-7981|360-493-4631|www.providence.org/giving|Civic|To provide medical scholarships to nursing students.
Junior League Of Palo Alto - Mid Peninsula|941603047|Approved|555 Ravenswood Avenue|Menlo Park|CA|94025|Ms. Sarah Rosendahl|President|(415) 321-5026|(650) 321-7493|http://www.thejuniorleague.org/|Civic|The Junior League of Palo Altoâ¬¢Mid Peninsula, Inc. (JLPAâ¬¢MP) is an organization of women committed to promoting voluntarism, developing the potential of women and improving communities through the effective action and leadership of trained volunteers.
Yad Ezra Inc|382904733|Approved|26641 Harding|Oak Park|MI|48237-1042|Ms. Lea Luger|Development Director|(248) 548-3663|(248) 548-3207|www.yadezra.org/|Human Services|To provide supplemental kosher food and other necessities to those in need in the Jewish Community. Yad Ezra is committed to operating a world class food pantry through the hard work and support of staff, donors and volunteers.
Helping After Neonatal Death|770006514|Approved|PO Box 341|Los Gatos|CA|95031-0341|Ms. Patti Nakamura|Treasurer|(888) 908-4263|(408) 247-7946|www.handonline.org|Human Services|To offer support to parents, their relatives, and friends during the normal mourning following a miscarriage, stillbirth, genetic abortion or newborn death.
Seattle Foundation|916013536|Approved|1200 Fifth Avenue|Seattle|WA|98101|Ms. Jennifer Sorensen|Director of Treasury|(206) 622-2294|(206) 622-7673|www.seattlefoundation.org|Civic|To encourage personal philanthropy in King County. We connect individuals with the issues they care about and provide them with support and inspiration to give effectively and improve our community.Seattle Foundation: To create an endowment to improve the quality of life in the Puget region.  The foundation's activities include...Facilitating and acting as a catalyst for charitable giving.  Administering charitable funds, trusts, gift annuities and bequests.  Pooling assets where possible to respond to community needs.  Distributing grants to non-profit organizations that are making a positive difference in the community.  Responding as a positive force to the changing needs of the community in a creative, sensitive, and timely manner.Microsoft Disability Scholarship: To empower and enable high schools students with disabilities to (a) go to college, (b) realize the impact technology has on the world, and (c) target a career in the technology industry.
American Veterinary Medical Foundation|366117739|Approved|1931 N. Meacham Road, Suite 100|Schaumberg|IL|60173-4360|Ms. Cindy Rutkowski|Manager, Services and Special Projects|(800) 248-2862|(847) 925-1329|http://www.avmf.org/|Human Services|Supports veterinary medical assistance teams and provides funds for treating animals hurt or endangered by these catastrophic events. Funds studies and educational programs that help us better understand this relationship, and how it leads to healthier more rewarding lives.
Navy-Marine Corps Relief Society|530204618|Approved|875 North Randolph Street|Arlington|VA|22203-1977|Mr. John W. Alexander|Vice President, Chief Communications Officer|(703) 696-4904|(703) 696-0144|www.nmcrs.org|Human Services|The mission of the Navy-Marine Corps Relief Society is to provide, in partnership with the Navy and Marine Corps, financial, educational, and other assistance to members of the Naval Services of the United States, eligible family members, and survivors when in need; and to receive and manage funds to administer these programs.
Notre Dame Academy Toledo Ohio|344428228|Approved|3535 W. Sylvania Avenue|Toledo|OH|43623|Mrs. Patricia Dunn|Director of Finance and Operation|(419) 475-9628|(419) 475-2558|http://www.nda.org/|Education Priv (K-12)|Notre Dame Academy, a Catholic college preparatory high school, sponsored by the Sisters of Notre Dame, promotes the holistic development of young women for leadership and service by providing an exceptional educational experience permeated with Christian values.Anti Discrimination Completed.
Mary, Queen of Peace Parish - Food and Clothing Drive|530196617|Approved|1121 228th Aveneue S.E.|Sammamish|WA|98075|Mr. Rich Shively|Parish Administrator|(425) 391-1178|(425) 391-3797|www.mqp.org|Civic|Food and Clothing Drive:  On the first full weekend of each month, Mary, Queen of Peace hosts a food drive to benefit the Issaquah Food and Clothing Bank, which serves low income individuals and families in our community.  In addition to food, personal hygiene items, cleaning supplies and baby diapers are provided.  Donations are also accepted for any nonperishable item any time of the month in the collection bins located in the building entrances.
Multiple Myeloma Research Foundation Inc|61504413|Approved|383 Main Avenue|Norwalk|CT|06851|Ms. Leslie Figueroa|Database Administrator|(203) 972-1250|(203) 972-1259|www.multiplemyeloma.org|Human Services|Dedicated to the single mission of accelerating the search for a cure for multiple myeloma.
Arizona Theatre Company|860211777|Approved|343 S. Scott Avenue|Tucson|AZ|85701|Ms. Rachel Rosen|Development Administrator|(520) 884-8210|(520) 628-9129|http://www.aztheatreco.org|Arts & Culture|To create professional theatre that continually strives to reach new levels of artistic excellence; that resonates locally, in the state of Arizona, and throughout the nation.
American Diabetes Association Inc|131623888|Approved|Suite 100|Springfield|MO|65804|Ms. Diana Rodriguez|Manager|(573) 443-8611|(573) 875-2152|www.diabetes.org|Human Services|To prevent and cure diabetes and to improve the lives of all people affected by diabetes.
Greater Kansas City Chapter Of The American Red Cross|530196605|Approved|211 West Armor Blvd.|Kansas  City|MO|64111|Ms. Rebecca Allman|Development Associate|(816) 931-8400|(816) 531-7306|www.kcredcross.org|Human Services|To provide relief to victims of disasters and help people prevent, prepare for and respond to emergencies.
Baltimore Polytechnic Institute Foundation Inc|521604007|Approved|1400 W Cold Springs Lane|Baltimore|MD|21209-4904|Ms. Jennifer Pawlo-Johnstone|Executive Director|(410) 889-7659|(410) 366-0709|www.bpi.edu/|Education|Prepare highly motivated students for success in college and in life by providing a rigorous STEM curriculum and instruction from faculty who are experts in their fields.
American Red Cross|530196605|Approved|167 Union Street South|Concord|NC|28025|Ms. Nancy Litton|Development Director|(704) 782-9022|(704) 720-7439|www.cabarruscountyredcross.org|Human Services|To provide relief to victims of disaster and help people prevent, prepare for, and respond to emergencies.
Crotched Mountain Foundation|20222168|Approved|One Verney Drive|Greenfield|NH|03047|Mrs. Katie Vilamarim|Donor Relations and Stewardship Manager|(603) 547-1488|(603) 547-6212|www.crotchedmountain.org/|Human Services|To promote, encourage, and sponsor charitable academic, medical, habilitative and related educational services to individuals with restrictive physical, emotional or cognitive challenges, including children and adults with developmental disabilities, traumatic head injuries, emotional considerations, neurologic or orthopedic challenges or other individuals within a broad category of diagnosis.  To assist children and adults with disabilities achieve optimal growth and independence.
Cystic Fibrosis Foundation|42297106|Approved|220 North Main St|Natick|MA|01760|Ms. Pamela Spitzer|Executive Director|(508) 655-6000|(508) 653-6942|www.cysticfibrosis.org|Human Services|To assure the development of the means to cure and control cystic fibrosis and to improve the quality of life for those with the disease.
Yellowstone Park Foundation Inc|830311166|Approved|222 East Main Street|Bozeman|MT|59715-4764|Ms. Olesja Hoppe|Annual Fund Manager|(406) 586-6303|(406) 586-6337|http://www.ypf.org|Environment|To preserve, protect and enhance Yellowstone National Park and to enrich each visitor's experience.
Saint Madeleine Sophie Parish-St. Vincent De Paul Society|530196617|Approved|4400 130th Place S.E.|Bellevue|WA|98006|Mrs. Karen Moretti|Parish Accountant|(425) 747-6770|(425) 747-6349|www.stmadsophie.org|Civic|Together with our Pastor and Bishops, we witness to Gods' saving love in our worship; minister to people in need; develop an informed faith and an understanding of the dynamic tradition of the Catholic Church; encourage good stewardship; and empower all to responsible participation in the life and work of the faith community.St. Vincent de Paul Society : To lead women and men to join together to grow spiritually by offering person-to-person service to those who are needy and suffering.
Mid-City Concerns Inc|910833015|Approved|1222 W 2nd Ave|Spokane|WA|99201|Miss Mollie Dalpae|Executive  Director|(509) 232-0864|509-458-7623|www.mowspokane.org|Human Services|Promote independent living of Spokane's senior citizens and disabled adults through outreach in nutrition, advocacy, education and recreation services.
Austin Meals on Wheels Endowment Fund|742689184|Approved|3227 E. 5th St.|Austin|TX|78702|Ms. Irma Mendoza|Manager of Donor Relations|(512) 476-6325|(512) 476-6478|http://www.mealsonwheelsandmore.org|Human Services|To Nourish and Enrich the Lives of the Homebound and Other People in Need Through Services Promoting Dignity and Independent Living.
Safe Horizon Inc|132946970|Approved|2 Lafayette Street|New York|NY|10007|Melissa Edler|Development Associate|(212) 577-8293|(646) 825-2230|www.safehorizon.org|Human Services|To heal the wounds of violence and prevent victimization and to restore the dignity and sufficiency for stranded travelers, immigrants and homeless people.
Walla Walla Valley Academy|916056118|Approved|300 SW Academy Way|College Place|WA|99324-1284|Ms. Cheryl Evanenko|Director of Development|(509) 525-1050|509-525-1056|www.wwva.org|Education Priv (K-12)|To provide students the opportunity, environment and example of living a life with Christ. Through competent and compassionate teaching we seek to inspirit our students to develop Christ-centered skills and habits.
The Bridgewater State University Foundation|222678005|Approved|25 Park Terrace|Bridgewater|MA|02325|Ms. Elizabeth R. Dubuque|Development Director|(508) 531-1288|(508) 531-1722|www.bridgew.edu|Education|To raise and manage funds for the benefit of Bridgewater State College. The Foundation works closely with the trustees, administration of the college, and our Alumni Association to promote the college and to raise private support for the institution.
Rape & Abuse Crisis Center of Fargo-Moorhead|411310289|Approved|317 N. 8th St.|Fargo|ND|58102|Mrs. Pam Sather|Business Director|(701) 293-7273|(701) 293-9424|www.raccfm.com|Human Services|To provide crisis intervention, advocacy, and counseling services free of charge to all persons who have been victims of domestic violence or sexual abuse, and to provide education and prevention programs to end personal violence in society.Rape and Abuse Crisis Center of Fargo Moorhead: Victim Services
United Mitochondrial Disease Foundation|251767180|Approved|8085 Saltsburg Road Suite 201|Pittsburgh|PA|15239|Mr. Mark Campbell|Chief Financial Officer|(412) 793-8077|(412) 793-6477|www.umdf.org|Human Services|To promote research for cures and treatments of Mitochondrial Disorders and provide support to affected families
New York Womens Foundation|133457287|Approved|434 West 33rd Street  8th Floor|New York|NY|10001|Ms. Sophie Danner|Development Coordinator|(212) 414-4342|(212) 564-7386|http://www.nywf.org/|Civic|To provide a cross-cultural alliance of women helping low-income women and girls achieve sustained economic self-sufficiency and self-reliance.
MAPS|592751953|Approved|1215 Mission St|Santa Cruz|CA|95060|Virginia Wright|Director of Development & Operations|831 429 6362|831 429 6370|www.maps.org|Human Services|The Multidisciplinary Association for Psychedelic Studies (MAPS) is a membership-based non-profit research and educational organization. We assist scientists to design, obtain approval for, fund, conduct and report on research into the healing and spiritual potentials of psychedelics and marijuana.
Accelerated Cure Project Inc|43555864|Approved|300 Fifth Ave.|Waltham|MA|02451|Melissa Mullen|Office Administrator|(781) 487-0008|(781) 487-0009|www.acceleratedcure.org|Human Services|To find a cure by developing a logical, organized, straight forward process based on what is known about the causes of MS. This process must be clearly spelled out and presented in a manner that is accessible to those involved researchers, clinicians, and individuals with MS.
The Gavi Fund|912004617|Approved|1776 I (Eye) Street, NW|Washington|DC|20006|Ms. Gina Schell|Manager Donor Relations|(202) 478-1050|(202) 478-1060|www.gavialliance.org|Human Services|To ensure that all of the world's people - no matter how rich or how poor - have equal access to life-saving vaccines.
Juvenile Diabetes Research Foundation International|231907729|Approved|15 Tech Valley Drive|East Greenbush|NY|12061|Ms. Rebecca Paslowski|Administrative Assistant|(518) 743-1700|(518) 683-7013|www.jdrf.org|Human Services|To find a cure for diabetes and its complications through the funding of research.
Detroit Lions Charities|382945709|Approved|C/O Detroit Lions|Allen Park|MI|48101|Mr. Tim Pendall|Trustee|(248) 972-8417|(248) 335-0764|www.detroitlions.com|Civic|To assist charitable and educational causes in Michigan with emphasis on programs that benefit the children and youth of Detroit.
Boys & Girls Clubs of Geneva, Inc.|161481026|Approved|1 Goodman Street|Geneva|NY|14456|Mr. John Kenny|Executive Director|(315) 781-2345|(315) 789-2047|www.genevabgc.org|Civic|To empower all young people, especially those who need us most, to reach their full potential.
Clelian Heights School|251647865|Approved|135 Clelian Heights Lane|Greensburg|PA|15601|Sr. Benjamin Merlotti|Director of Mission Advancement|(814) 837-8120|(724) 837-6480|www.clelianheights.org|Education Priv (K-12)|To provide spiritual, educational, vocational, and residential programs for children and adults with developmental challenges that enhance the quality of life and maximize their potential for independent living.
Metrolacrosse Inc|43508315|Approved|25 Thomson Place|Boston|MA|02210|Ms. Emily G. Helm|Corporate Executive Officer|(617) 288-9898|(617) 282-6367|www.metrolacrosse.com|Civic|To promote positive youth development and access to educational opportunities through the sport of lacrosse.
Sickle Cell Disease Association of America Inc|237175985|Approved|231 East Baltimore Street: Suite 8000|Baltimore|MD|21202|Ms. Deidra Turner|Administrative Assistant|(410) 528-1555|(410) 528-1495|www.scdfc.org/|Human Services|Providing public and professional education, patient and family service and support for research.
Learning Leaders|132658549|Approved|80 Maiden Lane|New York|NY|10038|Mr. Andrew Chipok|CFO|(212) 213-3370|(212) 213-0781|http://www.learningleaders.org/|Civic|To help New York City public school students gain the educational skills and self-esteem they need to become successful learners and productive community members.
Junior Achievement of Oki Partners|320014307|Approved|644 Linn Street|Cincinnati|OH|45203|Ms. Nancy Finke|Controller|(513) 894-2055|(513) 366-2490|www.japartners.org|Civic|To help kids understand the connection between responsibility, hard work, perseverance and success. To create a learning laboratory within the classroom, using a hands-on, interactive learning approach. We use business and community leaders as classroom instructors to share with students their most valuable resource their own personal experience.
Birthright Israel Foundation|134092050|Approved|33 East 33rd Street|New York|NY|10016|Jason Thompson|Donor Records Assistant|(212) 457-0036|(212) 419-2867|http://www.birthrightisrael.org|Human Services|To represent and serve 155 Jewish federations and 400 independent Jewish communities across North America. To reflect the values of social justice and human rights that define the Jewish people.
Deaf Action Center|751575599|Approved|3115 Crestview Drive|Dallas|TX|75235|Lisa Meehan|Accounting|(214) 521-0407|(214) 521-3658|www.dactexas.org|Human Services|To eliminate barriers to persons who are deaf or hard of hearing.
Muscular Dystrophy Association|131665552|Approved|1755 West Lakes Parkway|West Des Moines|IA|50266|Miss Danielle Etter|Executive Director|(515) 453-9489|(515) 453-9494|http://www.mdausa.org|Human Services|To fight 40 neuromuscular diseases through worldwide research, a nationwide network of clinics offering comprehensive medical services, and far-reaching professional and public health education.
Project Gutenberg Literary Archive Foundation Inc|646221541|Approved|809 N 1500 W|Salt Lake City|UT|84116|Mr. Thomas R. Wingate|CFO|(801) 596-1887|(801) 364-2059|www.gutenberg.org|Arts & Culture|To make information, books and other materials available to the general public in forms a vast majority of the computers, programs and people can easily read, use, quote, and search.
Golden Gate University|941585735|Approved|536 Mission Street|San Francisco|CA|94105|Ms. Flor Oliquiano|Advancement Services Coordinator|(415) 442-7000|(415) 495-2671|www.ggu.edu|Education|To change the lives of adult students through professional practice degree, certification and life-long learning programs in business, law, tax, technology and related professions.
Tacoma  Area Youth for Christ-Foster Care|362193619|Approved|P.O. Box 834|Tacoma|WA|98401|Mrs. Leslie Yohann|Office Manager|(253) 572-7888|(253) 572-7727|http://www.tacomayfc.org/how/foster_care/|Civic|TYFC Golf Challenge (Foster Care) : To raise funds for the programs of Tacoma YFC that impact young people and families by encouraging them in their physical, mental, social and spiritual growth througgh our 5 core teams of Foster care, Juvenile justice, campus life, parenting workshops and city life.Tacoma Area Youth For Christ - Foster Care: to have a noticeable spiritual impact on Pierce County by engaging young people in the life long journey of following Jesus Christ.Foster Care - to provide excellent care for children until they can be safely returned to their families. For those children not able to return home, the Tacoma YFC Foster Care team works to connect them with YFC adoptive families.
Atlanta Volunteer Lawyers Foundation Inc|581364400|Approved|235 Peachtree Street Northeast, Suite 1750 North Tower|Atlanta|GA|30303|Mr. Martin Ellin|Executive Director|(678) 681-6002|(404) 521-3434|www.avlf.org|Civic|Develops and coordinates programs that provide legal representation,education and advocacy for at-risk, low income individuals by tapping the enthusiasm and commitment of volunteer legal professionals to address the unmet civil legal needs in the Atlanta community.
Marin Conservation League|946089780|Approved|175 N. Redwood Dr.|San Rafael|CA|94903|Miss Dru Parker|Operations Manager|(415) 485-6257|(415) 485-6259|www.marinconservationleague.org/|Environment|To preserve, protect and enhance the natural assets of Marin County for all people.
Woodinville Fire And Life Safety District|910873317|Approved|PO Box 2200|Woodinville|WA|98072-2200|Ms. Linda Lane|Director of Development|(425) 483-7909|(425) 486-0361|www.wflsd.org|Civic|Dedicated to the preservation and protection of life and property through education, fire prevention, emergency services and disaster preparedness.
Charlotte Affiliate of Susan G. Komen for the Cure|752854959|Approved|2316 Randolph Rd.|Charlotte|NC|28207|Ms. Jessica Quinn|Accountant|(704) 347-8181|(704) 347-8145|www.komencharlotte.org|Human Services|To eradicate breast cancer as a life-threatening disease by advancing research education, screening and treatment.
Love Inc Of The Black Hills Inc A South Dakota Nonprofit Corporation|460460539|Approved|P.O Box 3255|Rapid City|SD|57709|Mr. John Ligtenberg|Executive Director|(605) 718-5683|(509) 352-2311|www.loveinconline.com|Human Services|To help out people in need in our community (Rimrock is on board). The main way we do this is by inventorying the church members for skills andabilities they have and would be willing to use to help people in need.Our job is linking legitimate needs with people who can meet those needs.
Downsize DC Foundation|542016115|Approved|872 Mark Dr|Akron|OH|44313|Mr. Jim Babka|President|(703) 236-5206|(703) 717-0463|www.americanlibertyfoundation.org/|Civic|To create and broadcast television ads which teach people about individual liberty, personal responsibility, and small, constitutionally limited government.
Asian Counseling and Referral Service|910916176|Approved|3639 MartinLuther King Jr. Way S|Seattle|WA|98144|Ms. Josephine Mumpar|Development Assistant|(206) 774-2404|(206) 695-7606|www.acrs.org|Arts & Culture|To promote the social, emotional, and economic well being and empowerment of Asian And Pacific Islander individuals, families and communities by providing and advocating for innovative community-based multilingual and multicultural services.Asian Counseling and Referral Service: To  help elders and adults with disabilities to maintain their highest level of independence at home by providing a comprehensive array of specialized behavioral health services to individuals and families.
YMCA of Cass and Clay Counties|450232096|Approved|400 1st Ave. South|Fargo|ND|58103|Miss Rachel Braaten|Financial Development Coordinator|(701) 364-4120|(701) 277-4832|www.ymcacassclay.org|Civic|To put Christian principles into practice through programs that build healthy spirit, mind, and body for all.
State Historical Society of ND Foundation|237305181|Approved|PO Box 1976|Bismarck|ND|58502|Ms. Virginia Nelsen|Executive Director|(701) 222-1966|(701) 328-3750|www.statehistoricalfoundation.com|Arts & Culture|To generate private financial support for the State Historical Society's projects and programs that cannot be funded by the legislature.
