Lambda Legal Defense And Education Fund Inc|237395681|Approved|120 Wall Street, 19th Floor|New York|NY|10005|Mr. Timothy Kochka|Database Associate|(212) 809-8585|(212) 809-4210|www.lambdalegal.org|Civic|Lambda's work includes Aids Project, Anti-Gay Initiatives, Employment Discrimination, Family relationships, Marriage Project, Military Ban, Political Asylum & Immigration, Youth & Schools, Sodomy Laws.Lambda Legal Defense and Education Fund Inc: Committed to achieving full recognition of the civil rights of lesbians, gay men, bisexuals, the transgendered, and people with HIV or AIDS through impact litigation, education, and public policy work.Our work on behalf of children and youth falls into three main categories: (1)Safeguarding the children and youth being raised by LGBT parents; (2) Advocacy on behalf of LGBT youth in foster care; (3) Protecting the civil rights of LGBT you attending public high schools.Lambda Legal Defense & Education Fund: To achieve full recognition of the civil rights of lesbians, gay men, bisexuals, the transgendered, and people with HIV or AIDS through impact litigation, education, and public policy work.Lambda Legal Defense and Education Fund Inc: Committed to achieving full recognition of the civil rights of  lesbians, gay men, bisexuals, transgender people and those with HIV through impact litigation, education and public policy work.Lambda Legal Defense and Education Fund, Inc.: To Achieving full recognition of the civil rights of lesbians, gay men, bisexualstransgender people and those with HIV through impact litigation, educationand public policy work.Lambda Legal Defense and Education Fund Inc: committed to achieving full recognition of the civil rights of lesbians, gay men, bisexuals, the transgendered, and people with HIV or AIDS through impact litigation, education, and public policy work.Lambda Legal Defense And Education Fund Inc: Is a national organization committed to achieving full recognition of the civil rights of lesbians, gay men and people with HIV/AIDS, through impact litigation, education and public policy work.
American Heart Association, Alameda County Chapter|135613797|Approved|1710 Gilbreth Rd|Burlingame|CA|94010|Ms. Yamilette Cerpas|Matching Gift Coordinator|(650) 259-6825|(650) 259-6895|http://www.americanheart.org|Human Services|To reduce disability and death from cardiovascular diseases and stroke.American Heart Association Inc: To reduce disability and death from cardiovascular diseases and stroke.
Engenderhealth Inc|131623838|Approved|440 9th Ave.|New York|NY|10001|Mrs. Elisabeth Platt|Development Assistant|(212) 561-8000|(212) 561-8067|www.engenderhealth.org|Human Services|This organization conducts family planning and reproductive health care.Engenderhealth Inc: EngenderHealth works worldwide to improve the lives of individuals by making reproductive health services safe, available, and sustainable. We provide technical assistance, training, and information, with a focus on practical solutions that improve services where resources are scarce. We believe that individuals have the right to make informed decisions about their reproductive health and to receive care that meets their needs. We work in partnership with governments, institutions, and health care professionals to make this right a reality.
Massachusetts Institute of Technology|42103594|Approved|600 Memorial Dr, W98-2nd Floor|Cambridge|MA|02139-4822|Ms. Sarah Hendrick|Director, Alumni Records|617-253-8246|617-252-1641|alum.mit.edu|Education|To advance knowledge and educate students in science, technology, and other areas of scholarship that will best serve the nation and the world in the 21st century.Massachusetts Institute of Tech: To serve diverse range of audiences by performing as a contemporary music ensembles: Commission, Produce locally, and tour nationally and work internationally as an electro acoustic band and work as a collaboratively-create opera and experimental theatre.Massachusetts Institute of Tech: To provide content, context, and contacts that enable entrepreneurs to design and launch successful new ventures based on innovative technologies.Massachusetts Institute of Tech: To benefit the public by moving results of M.I.T. research into societal use via technology licensing, through a process which is consistent with academic principles, demonstrates a concern for the welfare of students and faculty, and conforms to the highest ethical standards.The MIT Alumni/Ae Fund: To educate tomorrowâ¬"s innovative leaders, thinkers and strength to seize new opportunities and address changes unforeseen.MIT OpenCourseWare: Publish core teaching materialsâ¬including syllabi, lecture notes, assignments and examsâ¬from virtually all of MITâ¬"s courses. Extend the reach and impact of OCW and the OpenCourseWare concept.
Pacific Horticulture Foundation|941684498|Approved|PO Box 680|Berkeley|CA|94701|Ms. Carol Moholt|Executive Director|5105262853|(510) 524-1914|http://www.pacifichorticulture.org/|Environment|To receive and administer and expend funds for charitable, educational and scientific purposes in connection with horticulture.
Davidson College|560529961|Approved|Box 7174|Davidson|NC|28035|Ms. Kristen Tuttle|Director of Advancement Services|(704) 894-2980|(704) 892-2468|www.davidson.edu|Education|To assist students in developing humane instincts and deciplined and creative minds for lives of leadership and service.
Pilchuck Audubon Society|916183664|Approved|1429 Avenue D|Snohomish|WA|98290-1742|Mrs. Carolyn Lacy|Treasurer|(425) 252-0926|(360) 668-2494|http://www.pilchuckaudubon.org|Environment|To conserve and restore natural ecosystems, focusing on birds and other wildlife, for the benefit of the earthâ¬"s biological diversity.
Mercy Ships|262414132|Approved|PO Box 2020|Lindale|TX|75771|Ms. Denise Donovan|Donor Services Manager|(903) 939-7000|(903) 882-0336|www.mercyships.org|Human Services|Mercy Ships utilizes ocean-going vessels to bring physical and spiritual healing to the poor and needy in port cities around the world.  The ministry encourages societal change by following Christ's example, mobilizing volunteers to serve others through medical care, relief, community development training and evangelism.  The Mercy Ships have provided free operations, dental care, medical supplies, clothing, food seeds, construction materials, training and a message of hope.
Museum of Contemporary Art|366154098|Approved|220 East Chicago Avenue|Chicago|IL|60611|Monica Guerrant|Manager of Individual Giving|(312) 280-2660|(312) 397-4095|www.mcachicago.org|Arts & Culture|To collect, preserve, present, and interpret contemporary art and to engage a broad and diverse audience through these activities.
Mary Bridge Children's Foundation|943030039|Approved|P.O. Box 5296|Tacoma|WA|98415-0296|Mr. Frank Colarusso|Executive Director|(253) 552-1264|(253) 552-1534|http://www.multicare.org|Human Services|To raise funds and assist the hospital in achieving it's mission of providing care for all children, regardless of ability to pay.Mary Bridge Childrens Foundation-Multicare Medical Center: To raise funds and assist the hospital in achieving it's mission of providing care for all children, regardless of ability to pay.Mary Bridge Childrens Foundation: To raise funds and assist the hospital in achieving it's mission of providing care for all children, regardless of ability to pay.
Earthtrust|990172970|Approved|Windward Environmental Center|Kailua|HI|96734-0000|Mrs. Sue White|Treasurer|(808) 261-5339|(206) 202-3893|www.earthtrust.org/|Environment|One of the world's most effective wildlife conservation organizations.
Taproot Theatre Company|910971237|Approved|PO Box 30946|Seattle|WA|98113-0946|Patty Putnam|Development Assistant|(206) 781-9705|(206) 297-6882|www.taproottheatre.org|Arts & Culture|To serve the Western United States with touring productions, and the Puget Sound region with its Resident Theatre productions and Acting Studio.
CARE - Philadelphia|131685039|Approved|Room 106|Narberth|PA|19072|Ms. Irene Smith|Matching Gifts Coordinator|(610) 664-4113|(610) 664-4256|www.care.org|Human Services|To serve individuals and families in the poorest communities in the world. Drawing strength from our global diversity, resources and experience, we promote innovative solutions and are advocates for global responsibility.
American Whitewater Affiliation Incorporated|237083760|Approved|P.O Box 1540|Cullowhee|NC|28723|Ms. Carla Miner|Membership Services Manager|(828) 586-1930|(828) 586-2840|www.americanwhitewater.org|Human Services|To conserve and restore America's Whitewater resources and to enhance opportunities to enjoy them safely.
American Association for the Furtherance of Community|911187421|Approved|c/o The Goodenough Community|Tahuya|WA|98588|Mrs. Rachael Faasuamalie|Bookeeper|(206) 323-4653|(206) 322-3279|www.goodenough.org|Civic|To facilitate communication and networking between local, regional, and national intentional communities organizations; ascertain and promote intentional communities aims and values that contribute most to community sustainability.
University of Texas at San Antonio|741977996|Approved|One Utsa Circle|San Antonio|TX|78249-0631|Miss Evangelina Williams|Gift Services Manager|(210) 458-4011|(210) 458-4187|www.utsa.edu|Human Services|Strengthen ties among the University, it's past, present and future students, and the community, in order to promote and support programs and initiatives that advance academic excellence.University of Texas at San Antonio: To strengthen ties among the University, its past, present, and future students, and the community, in order to promote and support programs and initiatives that advance academic excellence.
Church Resource Ministries - Community Outreach Programs|953523150|Approved|1240 North Lakeview Avenue|Anaheim|CA|92807-1831|Mrs. Michelle Klewer|Ministry Partner Liaison|(714) 779-0370|(714) 779-0189|www.crmleaders.org|Human Services|The Mission of CRM:is to develop leaders to strengthen and start churches worldwideCRM envisions:Movements of fresh, authentic churches, Pioneered by godly leaders,Fired by a passion for their world,Compelled to multiply their lives and ministry,So that the name of God is renowned among the nations.Eligible Designations: Community Programs; Communitas; The Harbor; International and Nieu Communities
Far East Broadcasting Company Inc|951461574|Approved|P.O. Box 1|La Mirada|CA|90637|Christina Rivera|Mrs.|(562) 947-4651|(562) 943-0160|http://www.febc.org/|Civic|A non-denominational, international Christian radio network that broadcasts the Good News in more than 150 languages from 32 transmitters located throughout the world.
Connecticut Public Television and Radio|60758938|Approved|1049 Asylum Avenue|Hartford|CT|06105|Mr. Phong Kha|Matching Gifts Coordinator|(860) 278-5310|(860) 244-9624|http://www.cpbi.org/|Arts & Culture|To add value to people's lives through programs and services that inform, educate, entertain and inspire our audiences in Connecticut and beyond.Connecticut Public Broadcasting Inc: To serve diverse communities with a mix of news, public affairs, children's, educational and entertainment programming and services.Connecticut Public Radio: To add value to people's lives through programs and services that inform, educate, entertain and inspire our audiences in Connecticut and beyond.
United Way California Capital Region|941225382|Approved|10389 Old Placerville Road|Sacramento|CA|95827-2506|Ms. Victoria Kosha|Senior Vice President|(916) 368-3000|(916) 368-3029|www.unitedway.com|Civic|To mobilize the caring power of our community to improve the lives of people in need.
Citizens for Better Schools Foundation|911454155|Approved|P. O. Box 724|Fall City|WA|98024|Ms. Cheryl Duncan|Treasurer|(425) 396-7637|(425) 831-8222|www.snoqualmievalleyschoolsfoundation.org|Education|To build community for schools by: involving parents, students, teachers, businesses and community members.
Pacific Northwest Ski Education Foundation|237118655|Approved|2671 Flowery Trail Rd.|Usk|WA|99180|Mr. Paul Mahre|Executive Director|509-445-4454|(866) 542-8664|www.pnsef.org|Civic|To assist the Pacific Northwest Ski Association in educating its members and the public about all facets of local, national and international ski competition.Pacific Northwest Ski Educational Foundation: To enhance and support participation in competitive skiing in the Pacific Northwest by providing financial assistance for development and educational opportunities.
Crohn's and Colitis Foundation of America, WA State|136193105|Approved|National Processing Ctr / Matching Gift Dept|Albert Lea|MN|56007|Lydia Whelan|Matching Gifts Processor|(212) 685-3440|(212) 779-4098|www.ccfa.org|Human Services|To cure and prevent Crohn's disease and ulcerative colitis  through research, and to improve the quality of life of children and adults affected by these digestive diseases through education and support.Crohn's & Colitis Foundation of America: To cure and prevent Crohn's disease and ulcerative colitis  through research, and to improve the quality of life of children and adults affected by these digestive diseases through education and support.Crohn's and Colitis Foundation of Washington State: To cure Crohn's disease and ulcerative colitis, and to improve the quality of life of children and adults affected by these diseasesCrohns & Colitis Foundation of America: To cure and prevent Crohn's disease and ulcerative colitis  through research, and to improve the quality of life of children and adults affected by these digestive diseases through education and support.Crohns & Colitis Foundation of America: Dedicated to finding the cure for Crohn's disease and ulcerative colitisCrohn's and Colitis Foundation of Washington State: To cure Crohn's disease and ulcerative colitis, and to improve the quality of life of children and adults affected by these diseases
American Civil Liberties Union Foundation Inc|136213516|Approved|125 Broad Street|New York|NY|10004|Mr. Patrick Plain|Special Gifts Administrator|(212) 549-2519|(212) 549-2647|http://www.aclu.org/|Civic|Is our nation's guardian of liberty, working daily in courts, legislatures and communities to defend and preserve the individual rights and liberties guaranteed to all people in this country by the Constitution and laws of the United States.
Healthpoint|910884412|Approved|955 Powell Ave.|Renton|WA|98057|Ms. Lisa Yohalem|Development Director|(425) 203-0454|(206) 277-1566|healthpointchc.org|Human Services|To strengthen communities and improves peopleâ¬"s health by delivering quality health care services, breaking down barriers and providing access to all.
Agros International|911276578|Approved|2225 4th Ave Second Floor|Seattle|WA|98121|Miss Janet Stafford|Director of Finance|(206) 528-1066|(206) 528-0393|www.agros.org|Civic|Since 1982, Agros International has helped families in Central America & Mexico build self-sustaining and thriving communities.Agros International: To overcome the cycle of poverty in the world through ownership of land to build self-sustaining and thriving villages.
Bread for the World Institute Inc|510175510|Approved|425 3rd Street Southwest|Washington|DC|20024-3234|Ms. Rosamund Mason|Development Director|(301) 608-2400|(301) 608-2401|http://www.bread.org/|Human Services|Bread for the World is a collective Christian voice urging our nation's decision makers to end hunger at home and abroad.
Middlebury College|30179298|Approved|Gift Administration|Middlebury|VT|05753|Linda Quesnel|Gift Processing|(802) 443-5880|8024432290|www.middlebury.edu|Education|To offer its students a broad curriculum embracing the arts, humanities, literature, foreign languages, social sciences, and natural sciences.
National Rowing Foundation|132554312|Approved|67 Mystic Road|North Stonington|CT|06359|Mrs. Gillian Perry|Director of Fund Development|(860) 535-0634|(860) 535-0637|www.NatRowing.org|Civic|To support athletes who pursue excellence in the sport of rowing with the primary goal of promoting the United States' participation in international rowing competition, provide for the preservation of rowing history and manage the Rowing Hall of Fame.
Hackley School|131740452|Approved|293 Benedict Avenue|Tarrytown|NY|10591|Miss Kara Forcelli|Ms.|(914) 631-0128|(914) 631-0856|http://www.hackleyschool.org/|Education Priv (K-12)|SchoolMillion Dollar Round Table Foundation: Increase member participation and to give funds to worthwhile charitable organizations throughout the world.  The vision of the MDRT Foundation is to be the premier charitable foundation involving all members and improving the quality of life for those in need.
National Headache Foundation|237073022|Approved|820 North Orleans|Chicago|IL|60610|Ms. Maureen Ballay|Financial Services|(888) 643-5552|(312) 640-9049|http://www.headaches.org/|Human Services|Dedicated to serving headache sufferers, their families and the healthcare practitioners who treat them.  Promoting research into headache causes and treatments and educating the public to the fact that headaches are a legitimate biological disease and sufferers should receive understanding and continuity of care.
Susan G. Komen Breast Cancer Foundation|931068897|Approved|1500 SW 1th Avenue|Portland|OR|97201|Mr. Zach Nicolaides|Development Assistant|(503) 552-9160|(503) 552-9161|www.raceforthecure-pdx.org|Human Services|To eradicate breast cancer as a life-threatening disease by advancing research, education, screening and treatment.Susan G Komen Breast Cancer Foundation: To eradicate breast cancer as a life-threatening disease by advancing research education, screening and treatment.Susan G. Komen Breast Cancer Foundation: To eradicate breast cancer as a life-threatening disease by advancing research, education, screening and treatment.
Minnesota Public Radio|410953924|Approved|480 Cedar Street|St. Paul|MN|55101|Miss Nicole Greenly|Matching Gifts Coordinator|(612) 290-1500|(651) 290-1260|http://www.mpr.org/|Arts & Culture|To enrich the mind and nourish the spirit through radio, related technologies and services and to enhance the lives and expand the perspectives of our audiences and thereby assist them in strengthening their communities.
Adventist Development & Relief Agency|521314847|Approved|12501 Old Columbia Pike|Silver Spring|MD|20904|Mrs. Silvia Ochoa|Associate Director for Donor Relations|(301) 680-6380|(301) 680-6370|http://www.adra.org|Human Services|The Adventist Development and Relief Agency International (ADRA) is the worldwide humanitarian ARM of the Seventh-day Adventist Church. Established for the specific purposes of individual and community development and disaster relief, ADRA International fulfills this primary directive of its charter without regard to race, gender, political or religious affiliation in more than 120 countries.  ADRA International operates in five core portfolio activities: food security, economic development, primary health, disaster response and preparedness, and basic education.Adventist Development and Relief Agency: To provide assistance in situations of crisis or chronic distress, and work toward the development of long-term solutions with those affected. To work through equitable partnerships with those in need to achieve positive and sustainable change in communities.Adventist Development And Relief Agency International: Actively support communities in need through a portfolio of development activities which are planned and implemented cooperatively.Provide assistance in situations of crisis or chronic distress, and work toward the development of long-term solutions with those affected.
Frank Lloyd Wright Building Conservancy|363703598|Approved|53 West Jackson Blvd.|Chicago|IL|60604|Andrea Obey|Operations Manager|(312) 663-5500|(312) 663-5505|http://www.savewright.org/|Arts & Culture|To facilitate the preservation of the remaining structures designed by Frank Lloyd Wright. The Frank Lloyd Wright Building Conservancy is open to the public.
UNC-TV- Center for Public Television|566001393|Approved|10 T.W. Alexander Drive|Durham|NC|27711|Mrs. Arnetta Campbell|Annual Giving Manager|(919) 549-7129|(919) 549-7201|www.unctv.org|Arts & Culture|To use telecommunications wisely and imaginatively to inform, educate, and enrich all North Carolinians.UNC-TV (Corporate Giving): To provide color TV, closed captioning for the hearing impaired, descriptive video services for the blind, upgrade transmitters and translators, and the highest level of customer service and respect for our viewers, supporters and governing boards.
Guide Dog Foundation For The Blind Inc|111687477|Approved|371 East Jericho Turnpike|Smithtown|NY|11787-9897|Ms. Amy Davis|Office Assistant|(631) 930-9000|(631) 930-9009|www.guidedog.org|Human Services|To furnish guide dogs, free of charge, to qualified people who seek the independence, mobility and companionship a guide dog provides.
New York Public Radio|133015230|Approved|160 Varick Street|New York|NY|10013|Mrs. Tralana S. Gamadia|Matching Gifts Coordinator|646-829-4386|646-829-4317|http://www.wnyc.org/|Arts & Culture|To broadcast the finest programs from National Public Radio and Public Radio International, as well as a wide range of award-winning signature local programming.WNYC Radio: Committed to serving the area's changing needs with radio that enlightens, encourages and empowers the community as a whole.
Maple Hills PTA|911114800|Approved|15644 204th Ave Se|Renton|WA|98059|Ms. Joan Friel|Treasurer|(425) 837-5100|(425) 837-5108|www.maplehillspta.com|Human Services|Maple Hills PTA Board and Directors will lead the membership to an active and fulfilling year with increased communication, student enrichment, and parental participation.
Whale Museum|911007501|Approved|P.O. Box 945|Friday Harbor|WA|98250|Ms. Jenny L Atkinson|Executive Director|2063784710|(360) 378-5790|http://www.whale-museum.org/|Civic|Mission:  is to increase the public's understanding and appreciation of the environment with a special emphasis on whales.  The museum seeks, through education and research in the Sails Sea, to encourage responsible stewardship of this and other marine systems501(c)3Soundwatch: The Whale Museum seeks, through education and research, to encourage responsible stewardship of whales and the marine ecosystems upon which they depend.
Fcnl Education Fund|521254489|Approved|245 Second Street N.E.|Washington|DC|20002-5795|Mark Antonucci|Annual Fund Director|(202) 547-6000|(202) 547-6019|fcnl.org/about/edfund/|Education|To inform members of the public and government leaders about issues that have long been of concern to Quakers and others including war, the peaceful prevention of deadly conflict, conventional and nuclear arms control, the environment, federal budget priorities, and Native American issues.
Volunteer Center of North Texas|751364145|Approved|2800 Live Oak Street|Dallas|TX|75204|Ms. Julie Thomas|Executive Director|(817) 926-9001|(817) 926-9022|www.volunteernorthtexas.org|Human Services|To strengthen the community and its nonprofit sector by promoting volunteerism, mobilizing people and leveraging resources.
American Rivers Inc|237305963|Approved|7735 Old Georgetown Rd|Bethesda|MD|20814|Mr. Scott Myers|Major Gifts Coordinator|(202) 547-6900|(202) 347-9240|www.AmericanRivers.org|Civic|To protect and restore the nation's rivers and the clean water that sustains people, wildlife, and nature.
Detroit Rescue Missions Ministries|381459371|Approved|P. O. Box 312087|Detroit|MI|48231|Mr. Arthur Pfleger|Donor Services Director|(313) 993-4700|(313) 831-2299|http://www.drmm.org/|Human Services|To provide hope to the hopeless, abused, disadvantaged and homeless men, women and children of our community in â¬Srebuilding one life at a timeâ¬?.
United States Mission Corporation|941585260|Approved|P.O. Box 30666|Seattle|WA|98113|Mr. Brian Jones|Matching Funds Coordinator|(206) 781-9113|(206) 946-1099|www.usmission.org/|Human Services|To provide emergency and long term shelter, food and clothing to the elderly and homeless.
Downtown Emergency Service Center|911275815|Approved|507 3rd Avenue|Seattle|WA|98104|Ms. Hannah Mandala|Individual Gifts and Donor Stewardship Officer|(206) 464-1570|(206) 624-4196|www.desc.org|Human Services|We help people survive, and we help people permanently escape homelessness and become more independent and self-sufficient.
John Ball Zoological Society|386076879|Approved|PO Box 2506, 1300 W Fulton St|Grand Rapids|MI|49504|Frances Miller|Development Director|(616) 336-4301|(616) 336-3907|www.jbzoo.org|Arts & Culture|To advance public education on the need for wildlife conservation, to promote the welfare of the zoo as a public education institution, scientific center and natural and wildlife exhibit.
Foundation for Economic Education Inc|136006960|Approved|30 South Broadway|Irvington|NY|10533|Elise Thompson|Donor Relations Coordinator|(914) 591-7230|(914) 591-8910|www.fee.org|Education|To inspire, educate and connect future leaders with the economic, ethical and legal principles of a free society.
Resolve|237413696|Approved|1760 Old Meadow Road|Mc Lean|VA|22102|||(703) 556-7172|(703) 506-3266|www.resolve.org|Civic|To provide timely, compassionate support and information to individuals who are experiencing infertility and to increase awareness of infertility issues through advocacy and public education.
Community Health Project|133409680|Approved|356 W. 18th Street|New York|NY|10011|Mr. Ryan Ramirez|Development Associate|(212) 271-7274|(212) 271-8111|http://www.callen-lorde.org/|Human Services|To provide quality health care and related services primarily to New York's lesbian, gay, bisexual, and transgender communities regardless of ability to pay.
